{
  "schemaVersion": "1",
  "id": "graph:hello-world",
  "title": "Hello-world architecture",
  "description": "Greeting CLI, service, and formatting semantics; excludes persistence and network. Localization is not yet decided.",
  "nodes": [
    {
      "id": "surface:cli",
      "kind": "surface",
      "name": "Greeting interface",
      "description": "Accept a name and print the greeting without rebuilding its text.",
      "status": "proposed",
      "references": [
        {
          "kind": "design",
          "path": "requirements.md"
        }
      ]
    },
    {
      "id": "component:greeter",
      "kind": "component",
      "name": "Greeting service",
      "description": "Provide the greeting capability by calling the formatter.",
      "status": "proposed",
      "references": [
        {
          "kind": "design",
          "path": "requirements.md"
        }
      ]
    },
    {
      "id": "capability:greet",
      "kind": "capability",
      "name": "Greet a person",
      "description": "Return a greeting for a supplied name.",
      "status": "proposed",
      "references": [
        {
          "kind": "design",
          "path": "requirements.md"
        }
      ]
    },
    {
      "id": "component:formatter",
      "kind": "component",
      "name": "Formatter",
      "description": "Determine greeting text and normalize blank names to world.",
      "status": "proposed",
      "references": [
        {
          "kind": "design",
          "path": "requirements.md"
        }
      ]
    },
    {
      "id": "contract:greeting",
      "kind": "contract",
      "name": "Greeting format",
      "description": "Trim names; empty names become world; return Hello, NAME!.",
      "status": "proposed",
      "references": [
        {
          "kind": "design",
          "path": "requirements.md"
        }
      ]
    },
    {
      "id": "boundary:presentation",
      "kind": "boundary",
      "name": "Presentation boundary",
      "description": "The CLI must consume greeting text without independently reconstructing it.",
      "status": "proposed",
      "references": [
        {
          "kind": "design",
          "path": "requirements.md"
        }
      ]
    },
    {
      "id": "decision:tone",
      "kind": "decision",
      "name": "Greeting tone",
      "description": "Whether to offer greeting tones is unresolved.",
      "status": "unresolved",
      "references": [
        {
          "kind": "design",
          "path": "requirements.md"
        }
      ]
    }
  ],
  "relationships": [
    {
      "id": "relationship:provides",
      "kind": "provides",
      "from": "component:greeter",
      "to": "capability:greet",
      "description": "The service provides greeting behavior.",
      "status": "proposed",
      "references": [
        {
          "kind": "design",
          "path": "requirements.md"
        }
      ]
    },
    {
      "id": "relationship:cli-calls",
      "kind": "depends_on",
      "from": "surface:cli",
      "to": "component:greeter",
      "description": "The interface delegates greeting creation.",
      "status": "proposed",
      "references": [
        {
          "kind": "design",
          "path": "requirements.md"
        }
      ]
    },
    {
      "id": "relationship:formats",
      "kind": "depends_on",
      "from": "component:greeter",
      "to": "component:formatter",
      "description": "The service delegates text semantics to the formatter.",
      "status": "proposed",
      "references": [
        {
          "kind": "design",
          "path": "requirements.md"
        }
      ]
    },
    {
      "id": "relationship:authority",
      "kind": "authority_for",
      "from": "component:formatter",
      "to": "contract:greeting",
      "description": "The formatter determines greeting text semantics.",
      "status": "proposed",
      "references": [
        {
          "kind": "design",
          "path": "requirements.md"
        }
      ]
    },
    {
      "id": "relationship:preserves",
      "kind": "preserves",
      "from": "component:greeter",
      "to": "contract:greeting",
      "description": "Preserve the formatting result.",
      "status": "proposed",
      "references": [
        {
          "kind": "design",
          "path": "requirements.md"
        }
      ]
    },
    {
      "id": "relationship:boundary",
      "kind": "constrained_by",
      "from": "surface:cli",
      "to": "boundary:presentation",
      "description": "Do not reconstruct text in the CLI.",
      "status": "proposed",
      "references": [
        {
          "kind": "design",
          "path": "requirements.md"
        }
      ]
    },
    {
      "id": "relationship:tone",
      "kind": "affects",
      "from": "decision:tone",
      "to": "contract:greeting",
      "description": "A future tone choice changes the format contract.",
      "status": "proposed",
      "references": [
        {
          "kind": "design",
          "path": "requirements.md"
        }
      ]
    },
    {
      "id": "relationship:owns-greeting",
      "kind": "owns",
      "from": "component:greeter",
      "to": "capability:greet",
      "description": "The greeting service owns delivery of the greeting capability.",
      "status": "proposed",
      "references": [
        {
          "kind": "design",
          "path": "requirements.md"
        }
      ]
    }
  ]
}
